{
  "id": "taskloadsurvivalprofile://worldspec/h1-menagerie-right-robotiq/dual-teacher-v3",
  "profileVersion": "0.1.0",
  "status": "research",
  "stage": "loaded_track_settle_task_load_survival",
  "baseTrainingProfileDigest": "sha256:6c2002f7fedaae1739416c96e7698b389d8ddc7bedc7386921e141964128eec6",
  "a5ckEvidence": {
    "job": "worldspec-h1-midterm-5nn2q",
    "controlProfileDigest": "sha256:23fcf6908136c57880871ac0a1f9e1f13339b5d8f562eb0af8d710362f75efa8",
    "reportDigest": "sha256:a9d4458eb2ed16186c73e41dbdb16e1753e35ee32e30b0407eae981931f0256b",
    "controllerDigest": "sha256:0f1ffed386123d21cb45eb5708c2ed849cd22f7244e7a9ceb05a6df1bae8f0db",
    "traceDigest": "sha256:175427d1d3d74da7fe5c422f3290f07ae6dfa6c21179626dd4d4558915012bd9",
    "traceRecordCount": 386,
    "terminalReason": "fall_height",
    "maximumForwardCommand": 0.5,
    "maximumBackwardVelocity": -2.459172010421753,
    "formalControlGate": "failed"
  },
  "priorAttempt": {
    "sourceStage": "loaded-track-settle-task-load-retention-v2-failed",
    "sourceReportDigest": "sha256:9bce23e1c4bf26edff4db38c862e7da1b84b749d046bc7cbb480328cdaac38a0",
    "sourceReportSizeBytes": 30761,
    "checkpointDigest": "sha256:c5360ff126c3eb716710f43f615ee7f1be7604c36af95c4fd07e9f9048b7e15b",
    "checkpointSizeBytes": 1258786,
    "formalTrainingGate": "failed",
    "distribution": "internal_only"
  },
  "runtime": {
    "containerImage": "ccr-29eug8s3-pub.cnc.bj.baidubce.com/dataflow-poc/worldspec-h1-training@sha256:e0f101565d232de31b7f44d4f13d9a1616794b5ff0fc2253aacbb49244e29f46",
    "containerDigest": "sha256:e0f101565d232de31b7f44d4f13d9a1616794b5ff0fc2253aacbb49244e29f46",
    "packageLockDigest": "sha256:7cc88f20b2c608d6fe673f3b994b879db69d75361206bf25f949d7acc5ed3a41",
    "ccdIterations": 50
  },
  "warmStart": {
    "sourceStage": "loaded-track-settle-retention-v3-failed",
    "sourceReportDigest": "sha256:e232bed2b23400871fbe406ec8bf89463e19c293693616370febc2bc78cc7397",
    "checkpointDigest": "sha256:59697ea50339fa9ad17b9131c3369b761e0ff8345cf649be76549294472a4b8b",
    "checkpointSizeBytes": 6327077,
    "distribution": "internal_only",
    "restore": {
      "normalizer": true,
      "policy": true,
      "value": true
    },
    "optimizerState": "reset"
  },
  "standTeacher": {
    "sourceStage": "stand-v2.1",
    "sourceReportDigest": "sha256:8a92a910ca52540fff50bab37e20e7e28d4ea06ae0acd20d0079e8b45e65f660",
    "checkpointDigest": "sha256:fc91edb936de7391b7e075596e5aaa944acc656664cdb820dbb21c149cf7921c",
    "checkpointSizeBytes": 6280684,
    "distribution": "internal_only",
    "mode": "deterministic_action_distillation",
    "scope": "stand_replay_only"
  },
  "settleTeacher": {
    "sourceStage": "loaded-track-settle-capture-v1-passed",
    "sourceReportDigest": "sha256:8261f863d71cb66de46facb37b3c5ed121811e80fdabac057629ed366a52666f",
    "checkpointDigest": "sha256:7f8c45e7c0bf1d485706ca694c44e74bfd351ab4f753bfacff947e9f7e75cfbe",
    "checkpointSizeBytes": 6280278,
    "distribution": "internal_only",
    "mode": "deterministic_action_distillation",
    "scope": "transition_settle_only"
  },
  "trainingOverrides": {
    "numTimesteps": 16777216,
    "numEnvs": 4096,
    "numEvals": 8,
    "episodeLength": 1000,
    "unrollLength": 20,
    "numMinibatches": 16,
    "numUpdatesPerBatch": 4,
    "batchSize": 256,
    "learningRate": 0.00002,
    "entropyCost": 0.0005
  },
  "checkpointSelection": {
    "mode": "deterministic_gate_rank_v1",
    "evaluateAllSavedCheckpoints": true,
    "packageSelectedOnly": true
  },
  "environment": {
    "commandDistribution": {
      "linearVelocityX": [0.0, 0.6],
      "linearVelocityY": [-0.1, 0.1],
      "angularVelocityYaw": [-0.25, 0.25],
      "zeroCommandProbability": 0.2
    },
    "transitionCurriculum": {
      "mode": "move_then_zero_with_stand_replay",
      "transitionCycleProbability": 0.75,
      "standReplayProbability": 0.25,
      "moveSteps": 150,
      "settleSteps": 50,
      "motionCommandDistribution": {
        "linearVelocityX": [0.4, 0.6],
        "linearVelocityY": [-0.05, 0.05],
        "angularVelocityYaw": [-0.1, 0.1]
      }
    },
    "taskLoadCurriculum": {
      "mode": "static_right_arm_pose",
      "sourceJob": "worldspec-h1-midterm-5nn2q",
      "sourceTraceDigest": "sha256:175427d1d3d74da7fe5c422f3290f07ae6dfa6c21179626dd4d4558915012bd9",
      "heldTargetScale": [1.0, 1.0],
      "initialBaseVelocityX": [0.0, 0.0],
      "heldTargets": [
        0.0,
        0.0,
        0.0,
        0.0,
        0.0,
        0.1543052911758423,
        0.09892238825658843,
        -0.006488978405079102,
        -0.19852599334400028
      ],
      "heldFeedforward": [
        0.032988220529269176,
        -1.1402555002525037,
        0.08486267857762098,
        0.012800121336152957,
        -1.0451398037469817,
        -0.9578816827225751,
        0.837737275364864,
        0.46023224988862355,
        -4.402542577541209
      ],
      "observationAugmentation": "none",
      "qualityGatesChanged": false
    },
    "termination": {
      "minimumBaseHeight": 0.5,
      "minimumUprightCosine": 0.25,
      "jointLimitToleranceRadians": 0.02
    },
    "reward": {
      "survival": 3.0,
      "trackingLinear": 6.0,
      "trackingYaw": 2.0,
      "upright": 3.0,
      "baseHeight": 2.0,
      "pose": 0.5,
      "verticalVelocityCost": 1.0,
      "angularVelocityXYCost": 0.5,
      "torqueCost": 0.000002,
      "actionRateCost": 0.03,
      "settleLinear": 16.0,
      "settleYaw": 6.0,
      "settleActionRateScale": 0.15,
      "standDistillation": 4.0,
      "settleDistillation": 4.0,
      "standTeacherActionCost": 1.0,
      "settleTeacherActionCost": 1.0,
      "terminationPenalty": 25.0
    },
    "targets": {
      "baseHeight": 0.98
    },
    "sigmas": {
      "tracking": 0.2,
      "upright": 0.05,
      "baseHeight": 0.02,
      "pose": 0.2,
      "settleTracking": 0.05,
      "standDistillation": 0.05,
      "settleDistillation": 0.05
    },
    "commandResampleSteps": 200
  },
  "qualityGates": {
    "minimumFinalMeanEpisodeLength": 900.0,
    "nominalDurationSeconds": 4.0,
    "moveDurationSeconds": 3.0,
    "settleWindowSeconds": 1.0,
    "settleMeasurementWindowSeconds": 0.2,
    "requiredConsecutivePasses": 5,
    "minimumForwardDisplacement": 1.0,
    "maximumForwardDisplacement": 2.2,
    "maximumLateralDrift": 0.2,
    "maximumTrackingRmse": 0.25,
    "minimumBaseHeight": 0.8,
    "minimumUprightCosine": 0.8,
    "maximumSettleLinearSpeed": 0.2,
    "maximumSettleAngularSpeed": 0.4,
    "maximumStandPlanarDrift": 0.2,
    "maximumNonFiniteSamples": 0
  },
  "artifactPolicy": {
    "checkpoint": "research_only",
    "distribution": "internal_only"
  },
  "evidenceStatus": "derived"
}
